UID,NAME,NAME_KANA,ZIP,ADDRESS,PHONE,EMAIL,DATE_OF_BIRTH,GENDER
000001,小川 充,オガワ ミツル,524-4231,香川県青ヶ島村木立28丁目26番16号 渡辺シャルム201,070-6726-6217,yumiko91@example.com,1998-05-02,M
000002,田中 七夏,タナカ ナナミ,353-6342,新潟県江東区土呂部4丁目14番14号 氏家新田アーバン697,080-1826-4029,byamada@example.org,2006-11-01,F
000003,田中 香織,タナカ カオリ,086-7015,奈良県印旛郡印旛村脚折町16丁目7番18号 一ツ橋シャルム682,71-8930-9389,satonaoki@example.com,2022-04-13,M
000004,中島 加奈,ナカジマ カナ,979-7174,長崎県昭島市蟇沼13丁目19番9号 ハイツ無栗屋191,080-9022-7803,hsakamoto@example.com,1970-03-02,M
000005,斎藤 洋介,サイトウ ヨウスケ,717-8873,鳥取県台東区松が谷18丁目2番20号,080-0771-6374,atsushifujiwara@example.net,2020-07-16,F
000006,佐藤 亮介,サトウ リョウスケ,319-2192,三重県昭島市五味ヶ谷10丁目5番11号 パレス大京町854,070-5349-7785,yuihashimoto@example.net,1974-05-14,F
000007,山本 智也,ヤマモト トモヤ,248-4218,石川県中野区平河町23丁目27番20号,070-0832-5631,lnishimura@example.com,1972-04-13,M
000008,鈴木 篤司,スズキ アツシ,953-0313,長崎県品川区氏家新田38丁目2番4号 アーバン卯の里110,080-5270-8192,sotaro18@example.com,1988-03-25,M
000009,石川 陽一,イシカワ ヨウイチ,388-2137,福井県横浜市中区丸の内35丁目23番15号 シャルム平須賀596,090-8333-5050,fujiirei@example.org,1911-10-12,M
000010,阿部 明美,アベ アケミ,233-9028,長崎県青梅市白金台38丁目20番6号 アーバン無栗屋941,080-9274-6383,rokada@example.org,1922-06-23,M
000011,中川 真綾,ナカガワ マアヤ,926-1558,茨城県八王子市前弥六南町26丁目2番14号 パレス西浅草395,53-6310-0255,kimurayoko@example.net,1987-04-09,F
000012,小林 淳,コバヤシ ジュン,257-8730,三重県杉並区豊町27丁目13番14号 千塚ハイツ832,070-5525-3905,ugoto@example.net,2013-10-13,M
000013,吉田 あすか,ヨシダ アスカ,847-6665,徳島県長生郡一宮町三ノ輪31丁目3番20号 クレスト三ノ輪194,070-2385-2860,yosukemaeda@example.net,1963-03-15,F
000014,佐藤 淳,サトウ ジュン,115-8547,広島県横浜市瀬谷区平須賀35丁目14番4号,090-8684-1061,wmiura@example.net,2022-09-18,F
000015,高橋 舞,タカハシ マイ,075-3718,長野県横浜市戸塚区中小来川21丁目19番15号,090-1164-6525,fnakajima@example.com,1920-03-08,M
000016,鈴木 桃子,スズキ モモコ,907-8649,山口県練馬区細竹35丁目8番13号 パーク中川崎078,60-6765-7198,matsudarika@example.net,2005-11-13,F
000017,佐藤 亮介,サトウ リョウスケ,533-7263,宮崎県北区明石町2丁目19番12号,080-0474-6029,iaoki@example.com,2010-09-07,M
000018,鈴木 加奈,スズキ カナ,962-5736,新潟県千代田区長畑23丁目22番8号,24-3709-2291,tishikawa@example.org,1984-02-13,F
000019,近藤 桃子,コンドウ モモコ,278-2515,静岡県あきる野市藤金37丁目15番6号 シャルム細竹472,070-3705-6288,endoakira@example.net,1981-02-23,F
000020,小林 くみ子,コバヤシ クミコ,121-3875,大分県八丈島八丈町丸の内ＪＰタワー18丁目6番4号 コート小入796,090-9403-8430,tishii@example.net,1931-05-17,F
000021,松田 学,マツダ マナブ,544-5965,京都府東久留米市高田馬場37丁目4番14号 東浅草コート012,070-5367-3553,yoko36@example.com,1954-03-03,F
000022,佐々木 太郎,ササキ タロウ,233-4852,石川県東村山市神明内42丁目21番2号 戸山シティ742,070-4529-9360,fujitatsubasa@example.net,1944-04-05,M
000023,橋本 康弘,ハシモト ヤスヒロ,193-7846,福井県八丈島八丈町藤金15丁目16番4号,080-0114-8264,yokoota@example.net,1965-06-22,M
000024,中村 英樹,ナカムラ ヒデキ,145-8975,長野県富里市前弥六南町17丁目23番1号 港南パレス114,080-0088-0387,kmurakami@example.com,1924-06-19,F
000025,渡辺 学,ワタナベ マナブ,487-2732,愛媛県いすみ市権現堂42丁目22番20号 四番町シャルム860,32-3459-4949,naoto48@example.org,1938-04-10,F
000026,坂本 真綾,サカモト マアヤ,732-3146,兵庫県東大和市睦5丁目3番13号,080-4783-9428,vkobayashi@example.net,2006-12-04,M
000027,山田 篤司,ヤマダ アツシ,547-4294,奈良県横浜市戸塚区戸島38丁目24番14号 隼町パーク473,090-0230-9112,okamotoyumiko@example.net,1955-08-26,F
000028,山田 淳,ヤマダ ジュン,920-3289,岡山県目黒区芝公園8丁目10番13号,090-5593-3329,yasuhiro03@example.org,1928-04-20,F
000029,斉藤 充,サイトウ ミツル,166-0210,静岡県横浜市鶴見区東三島18丁目6番14号 戸山コーポ264,070-7231-2025,zmori@example.org,1994-06-29,F
000030,加藤 和也,カトウ カズヤ,922-6392,京都府小金井市中鉢石町32丁目3番3号 南郷屋シティ185,070-4128-1586,tfujita@example.org,2000-03-31,M
000031,伊藤 治,イトウ オサム,808-3184,滋賀県江戸川区箪笥町3丁目21番2号 パーク月島341,080-7782-1337,yosuke52@example.org,1945-06-30,M
000032,渡辺 香織,ワタナベ カオリ,162-0185,茨城県新宿区手岡17丁目12番17号,070-5705-7416,sayuri97@example.net,2012-05-22,M
000033,井上 拓真,イノウエ タクマ,911-8808,三重県豊島区隼町3丁目15番18号 パーク千塚583,080-6745-6296,shimizunaoto@example.org,1911-05-04,M
000034,森 花子,モリ ハナコ,761-6633,和歌山県四街道市幸手30丁目14番9号,090-3575-7904,yasuhiro44@example.org,1926-07-31,F
000035,佐藤 翼,サトウ ツバサ,130-9403,愛媛県袖ケ浦市猿楽町11丁目10番16号 蟇沼クレスト123,070-1830-2963,kumiko56@example.com,1968-02-20,M
000036,山下 さゆり,ヤマシタ サユリ,687-2237,山梨県八丈島八丈町平河町15丁目26番7号 パレス南赤田865,070-9085-3108,rfujii@example.net,2011-12-20,M
000037,佐々木 英樹,ササキ ヒデキ,992-7387,山形県北区高輪23丁目2番8号 クレスト京橋449,99-1387-8404,kimurayoichi@example.net,1930-05-06,F
000038,橋本 さゆり,ハシモト サユリ,838-8106,和歌山県利島村蟇沼28丁目18番17号,090-4818-6663,kazuyasakamoto@example.com,1957-08-30,F
000039,中村 涼平,ナカムラ リョウヘイ,050-9865,長崎県稲城市秋葉原36丁目21番6号 クレスト東三島733,070-7356-0198,yoko08@example.com,1955-03-09,M
000040,高橋 健一,タカハシ ケンイチ,401-5409,広島県横浜市金沢区長畑30丁目9番7号,59-9987-8767,takahashiryosuke@example.org,1994-11-05,M
000041,坂本 結衣,サカモト ユイ,672-5637,北海道山武郡芝山町轟12丁目19番4号,080-0228-3802,sayuri87@example.com,1942-04-03,M
000042,木村 健一,キムラ ケンイチ,523-4634,新潟県国立市鶴ヶ丘9丁目8番8号 パーク一ツ橋699,080-1283-3574,yutawatanabe@example.net,1992-01-07,F
000043,田中 浩,タナカ ヒロシ,467-4755,鳥取県山武市白金台42丁目11番16号,080-2550-7834,pkimura@example.net,2012-07-05,M
000044,佐々木 亮介,ササキ リョウスケ,967-6241,大阪府東大和市津久戸町13丁目11番4号,090-8573-1457,pkondo@example.net,1954-05-30,M
000045,中村 充,ナカムラ ミツル,097-9683,大阪府利島村柿木沢32丁目11番10号,070-8999-2520,zyamaguchi@example.com,1997-08-03,F
000046,渡辺 陽一,ワタナベ ヨウイチ,087-7522,福島県横浜市旭区丹勢10丁目21番7号 長間クレスト185,070-6980-8029,naoki44@example.net,2010-12-16,F
000047,石井 智也,イシイ トモヤ,571-6354,兵庫県利島村東大和町9丁目1番15号 コーポ池之端627,090-1883-0109,itokyosuke@example.org,1998-11-19,F
000048,佐藤 翼,サトウ ツバサ,365-5701,愛媛県山武郡九十九里町大中33丁目11番9号 シャルム勝どき059,090-6484-8456,mmatsuda@example.net,1915-04-23,F
000049,伊藤 裕樹,イトウ ユウキ,491-7024,広島県袖ケ浦市東浅草12丁目18番1号 松浦町コーポ170,23-1823-7706,yutaabe@example.com,2022-03-07,M
000050,松本 さゆり,マツモト サユリ,405-3011,茨城県川崎市高津区浅草37丁目25番10号,070-9030-9834,gota@example.net,1959-06-03,F
000051,山下 治,ヤマシタ オサム,234-3810,愛媛県練馬区脚折21丁目5番16号 シャルム北青山050,080-9223-2200,atsushi25@example.org,1965-10-24,F
000052,伊藤 晃,イトウ アキラ,144-8657,岡山県横浜市神奈川区中川崎11丁目10番20号 小入ハイツ170,090-3350-1462,wyoshida@example.net,1943-12-11,M
000053,岡田 知実,オカダ サトミ,134-6458,秋田県西多摩郡檜原村上広谷17丁目7番4号 シティ湯本塩原025,070-2155-1888,hiroshigoto@example.org,1999-06-05,F
000054,清水 桃子,シミズ モモコ,356-1292,愛知県国立市大京町21丁目23番17号,070-2721-8368,ztanaka@example.net,1926-07-29,M
000055,加藤 治,カトウ オサム,301-3171,福島県小平市台場30丁目22番4号,26-1699-0028,uogawa@example.org,1925-01-19,F
000056,松本 治,マツモト オサム,372-2610,奈良県西多摩郡瑞穂町油井19丁目15番1号,070-6463-6899,sayuriyamada@example.net,1907-04-29,F
000057,木村 和也,キムラ カズヤ,648-4996,北海道横浜市都筑区無栗屋22丁目9番15号 花川戸シティ103,080-3106-0858,tomoyasaito@example.net,2005-12-29,F
000058,池田 健一,イケダ ケンイチ,001-6890,福井県神津島村京橋7丁目12番19号 パレス権現堂044,09-0873-5659,tomoyasato@example.org,1950-06-29,M
000059,後藤 裕美子,ゴトウ ユミコ,348-3388,長崎県横浜市泉区猿楽町11丁目17番17号 今戸パレス616,080-8790-7016,kimurahideki@example.com,1912-08-14,F
000060,石川 春香,イシカワ ハルカ,918-4104,石川県八王子市中小来川17丁目14番15号 下吉羽シティ269,090-6439-7902,yokookada@example.com,1929-12-10,M
000061,鈴木 直人,スズキ ナオト,459-2360,熊本県荒川区柿木沢新田37丁目1番12号 前弥六アーバン006,87-8128-1684,atsushimatsumoto@example.org,1972-04-07,F
000062,福田 桃子,フクダ モモコ,476-7563,鳥取県八千代市元浅草2丁目10番3号,080-0107-3463,cyamaguchi@example.com,1919-08-27,F
000063,鈴木 健一,スズキ ケンイチ,493-1490,佐賀県小平市台場7丁目3番12号,090-4476-6166,ookamoto@example.com,2007-03-26,F
000064,山口 太郎,ヤマグチ タロウ,298-5677,滋賀県西東京市四番町26丁目27番7号 コート上高野342,090-8742-4680,yamazakinanami@example.com,1922-06-05,M
000065,藤原 充,フジワラ ミツル,418-2730,埼玉県我孫子市藤金21丁目18番1号 松が谷パレス894,32-2230-4095,nakagawatakuma@example.org,1982-03-16,F
000066,佐藤 太郎,サトウ タロウ,652-0229,千葉県東大和市土呂部31丁目6番3号,080-3066-5829,yutasato@example.net,2016-09-01,M
000067,伊藤 裕太,イトウ ユウタ,616-9576,三重県豊島区今戸40丁目20番6号,31-1358-1827,shota71@example.com,2022-02-23,F
000068,中島 裕太,ナカジマ ユウタ,749-6990,群馬県富津市独鈷沢1丁目15番14号 シャルム猿楽町388,070-0049-7739,hasegawamomoko@example.org,1972-04-17,F
000069,渡辺 治,ワタナベ オサム,500-4716,京都府清瀬市西神田13丁目10番19号 パレス今戸478,090-2939-5407,kenichisaito@example.com,1944-10-08,M
000070,山田 七夏,ヤマダ ナナミ,975-9274,富山県西多摩郡檜原村手岡24丁目16番3号 パレス権現堂568,25-8902-7986,hayashitakuma@example.com,1933-02-28,M
000071,田中 直子,タナカ ナオコ,344-5464,香川県印旛郡栄町戸山5丁目24番4号 クレスト西浅草998,070-5114-2732,enakajima@example.org,1930-03-12,F
000072,伊藤 春香,イトウ ハルカ,342-1169,長崎県長生郡一宮町猿楽町25丁目11番17号,080-0562-7728,osakamoto@example.org,1946-10-07,M
000073,高橋 篤司,タカハシ アツシ,072-8271,長野県鎌ケ谷市戸塚町15丁目21番20号 土呂部クレスト723,080-8412-8467,lsakamoto@example.org,1941-08-30,F
000074,森 洋介,モリ ヨウスケ,144-1448,宮城県横浜市青葉区白金2丁目22番4号 五味ヶ谷シティ626,080-8709-1470,nakajimasayuri@example.net,1979-12-26,M
000075,山田 裕太,ヤマダ ユウタ,360-6708,福岡県三鷹市橋場5丁目8番13号,080-1005-5941,itoshota@example.net,1920-03-20,F
000076,吉田 健一,ヨシダ ケンイチ,131-3290,北海道国立市千束17丁目20番2号 前弥六クレスト015,070-9571-2865,kobayashitaichi@example.com,1980-10-28,F
000077,山崎 あすか,ヤマザキ アスカ,842-0647,栃木県新宿区所野38丁目3番7号,080-2652-8535,tarosaito@example.com,1923-08-28,M
000078,橋本 治,ハシモト オサム,291-1520,宮崎県長生郡睦沢町入谷1丁目8番7号,070-1566-0600,gfukuda@example.com,1993-05-23,M
000079,鈴木 花子,スズキ ハナコ,207-9668,熊本県墨田区芝浦2丁目1番18号 シャルム長畑656,070-7176-7578,yoichi98@example.org,2002-02-08,M
000080,佐藤 春香,サトウ ハルカ,043-9283,長野県青梅市上野桜木13丁目2番16号 シャルム鶴ヶ丘635,080-4258-5194,miki41@example.com,1996-06-29,M
000081,佐々木 明美,ササキ アケミ,070-6968,長崎県香取郡神崎町皇居外苑20丁目2番5号 アーバン日光063,080-1957-0589,nakamurachiyo@example.com,1985-01-28,M
000082,佐藤 明美,サトウ アケミ,956-1704,長崎県長生郡一宮町豊町29丁目17番12号 西浅草コーポ582,070-4766-2668,bkondo@example.org,1911-06-03,M
000083,山田 康弘,ヤマダ ヤスヒロ,630-8189,岐阜県東久留米市前弥六南町33丁目21番8号,01-5628-1672,mainakagawa@example.net,1916-01-12,F
000084,佐々木 浩,ササキ ヒロシ,248-5188,東京都横浜市南区土呂部42丁目13番3号 皇居外苑パーク027,080-7123-0551,minoruhasegawa@example.org,1974-02-21,M
000085,斎藤 陽子,サイトウ ヨウコ,979-2727,長野県中野区戸山9丁目24番3号 シティ轟296,080-5246-9205,dmaeda@example.org,1977-05-29,M
000086,田中 智也,タナカ トモヤ,801-0646,群馬県横浜市中区長間14丁目2番6号 シティ高輪430,41-5522-6867,yamamotohiroshi@example.org,1960-01-02,M
000087,橋本 直樹,ハシモト ナオキ,423-9325,北海道中央区湯宮33丁目1番11号 ハイツ虎ノ門虎ノ門ヒルズ森タワー596,080-6162-0325,nwatanabe@example.com,2008-02-09,F
000088,山本 浩,ヤマモト ヒロシ,655-4011,福井県夷隅郡大多喜町柿木沢新田40丁目17番19号,50-3776-7196,yoichimurakami@example.com,2000-12-07,M
000089,田中 浩,タナカ ヒロシ,490-4019,山口県川崎市宮前区台東41丁目27番3号,080-1312-3871,akirayoshida@example.org,1928-01-29,M
000090,小林 聡太郎,コバヤシ ソウタロウ,707-6851,千葉県川崎市幸区横林30丁目6番9号 パーク油井403,080-4910-4971,yutaendo@example.com,1933-10-03,F
000091,坂本 充,サカモト ミツル,737-6290,岡山県大島町大中35丁目10番5号 太田ヶ谷パーク928,080-6055-4133,shoheinakagawa@example.com,1929-02-11,M
000092,佐藤 和也,サトウ カズヤ,882-7241,岡山県西東京市箪笥町21丁目16番4号 パレス氏家新田234,080-8367-8713,efujiwara@example.com,1940-11-26,F
000093,山口 篤司,ヤマグチ アツシ,839-9151,長野県三鷹市麹町15丁目4番11号 クレスト南赤田212,090-1292-3698,otaatsushi@example.net,1929-10-01,F
000094,山本 直樹,ヤマモト ナオキ,764-7437,東京都浦安市浅草橋29丁目16番3号 戸島パーク584,090-6645-1272,msuzuki@example.com,1978-01-27,M
000095,佐藤 舞,サトウ マイ,589-9379,和歌山県横浜市磯子区藤金40丁目1番20号 北上野パレス282,070-8211-8137,tfujiwara@example.net,1939-12-25,M
000096,斎藤 涼平,サイトウ リョウヘイ,850-3358,青森県我孫子市池之端5丁目7番15号 富久町ハイツ820,33-7061-9314,nakagawamomoko@example.net,1921-01-31,F
000097,三浦 充,ミウラ ミツル,648-8071,広島県横浜市鶴見区大中27丁目3番13号,070-3870-4959,mogawa@example.net,2019-07-29,F
000098,三浦 真綾,ミウラ マアヤ,701-2295,宮城県台東区津久戸町1丁目23番10号 コート花島889,090-0705-9992,nakamuranaoko@example.com,1959-04-01,M
000099,山本 太一,ヤマモト タイチ,644-3999,岐阜県安房郡鋸南町鍛冶ケ沢25丁目22番13号 パーク上吉羽063,19-7995-1151,naoko72@example.com,1948-08-14,M
000100,松本 里佳,マツモト リカ,418-0596,宮城県印旛郡酒々井町竜泉11丁目9番19号 コーポ松石473,090-6125-0034,kishikawa@example.com,1941-01-24,F
